{
	"schema": "docmend/reference-environment",
	"schema_version": "1.0",
	"operating_system": "linux",
	"cpu_architecture": "x86_64",
	"cpu_model": "Intel(R) Core(TM) Ultra 7 155H",
	"logical_cpu_count": 22,
	"ram_bytes": 66969681920,
	"storage_class": "local-ssd",
	"filesystem": "btrfs",
	"mount_flags": ["rw", "noatime"],
	"python_version": "3.14.6",
	"kernel_version": "7.1.3-200.fc44.x86_64"
}
